{
  "schemaVersion": "1.0",
  "decisionId": "gm-009-invalidation-wait",
  "symbol": "XAUUSD",
  "generatedAt": "2026-07-20T06:57:00Z",
  "marketDataTime": "2026-07-20T06:56:00Z",
  "validUntil": "2026-07-20T09:33:00Z",
  "decision": "WAIT",
  "confidence": 35,
  "confidenceLabel": "LOW",
  "marketRegime": "TRANSITION",
  "dataQuality": "INVALID",
  "isProvisional": false,
  "setupScore": -10,
  "entry": {
    "type": "NONE",
    "price": null,
    "zoneLow": null,
    "zoneHigh": null,
    "condition": "Prior setup invalidated."
  },
  "stopLoss": {
    "price": null,
    "reason": null
  },
  "takeProfits": [],
  "riskReward": {
    "tp1": null,
    "tp2": null,
    "tp3": null
  },
  "breakeven": {
    "state": "HOLD_ORIGINAL_STOP",
    "trigger": null,
    "newStop": null,
    "reason": "No active trade plan."
  },
  "earlyExit": {
    "exitNow": true,
    "conditions": [
      "Wait decision remains valid until confirmation improves"
    ]
  },
  "bullishEvidence": [
    "Longer-term thesis not fully broken"
  ],
  "bearishEvidence": [
    "Price closed through stop level",
    "Volatility expanded against setup"
  ],
  "reasonCodes": [
    "INVALIDATION-WAIT",
    "INVALID",
    "MOCK"
  ],
  "reasonSummary": [
    "WAIT because the prior setup is invalidated.",
    "A new signal must form from fresh structure."
  ],
  "warnings": [
    "Do not reuse an invalidated trade plan."
  ],
  "missingInputs": [],
  "invalidation": "Invalidated by close through prior stop and volatility expansion.",
  "disclaimer": "GoldMeta provides market analysis and decision support only. Trading involves substantial risk. Signals are not guaranteed, and you remain responsible for every trading decision.",
  "lifecycleState": "INVALIDATED",
  "snapshotId": "snap-009",
  "ruleConfigVersion": "rules-ios-phase1-1.0.0",
  "pineScriptVersion": "goldmeta-bridge-v0.1",
  "backendVersion": "mock-ios-phase1",
  "aiModelId": null,
  "aiPromptVersion": null,
  "aiSafetyDowngraded": false,
  "notificationSent": false,
  "currentSession": "London / New York overlap",
  "higherTimeframeBias": "NEUTRAL",
  "lastKnownPrice": 2398.4,
  "dataSourceLabel": "MOCK"
}
